{
  "schema_version": "1.0",
  "id": "concept:cors-misconfiguration",
  "slug": "cors-misconfiguration",
  "title": "CORS Misconfiguration",
  "kind": "vulnerability",
  "aliases": [
    "cors bypass",
    "cors misconfiguration"
  ],
  "parents": [
    "concept:cors"
  ],
  "mappings": {
    "cwe": [
      {
        "id": "cwe/CWE-942",
        "confidence": "high"
      }
    ],
    "owasp_top10": [
      {
        "id": "owasp/top10/2021/A05",
        "confidence": "medium",
        "note": "Bucket-level mapping."
      }
    ],
    "owasp_api10": [
      {
        "id": "owasp/api10/2023/API8",
        "confidence": "high"
      }
    ]
  }
}