{
  "schema_version": "1.0",
  "id": "concept:ats-disabled",
  "slug": "ats-disabled",
  "title": "iOS ATS Disabled",
  "kind": "variant",
  "aliases": [
    "ats disabled"
  ],
  "parents": [
    "concept:insecure-communication",
    "concept:ios"
  ],
  "mappings": {
    "owasp_mobile10": [
      {
        "id": "owasp/mobile10/2024/M5",
        "confidence": "high"
      }
    ]
  }
}