{
  "schema_version": "1.0",
  "id": "concept:third-party-sdk-risk",
  "slug": "third-party-sdk-risk",
  "title": "Third-Party SDK Risk",
  "kind": "vulnerability",
  "aliases": [
    "third party sdk risk",
    "tracking sdk"
  ],
  "parents": [
    "concept:mobile-supply-chain",
    "concept:privacy"
  ],
  "mappings": {
    "owasp_mobile10": [
      {
        "id": "owasp/mobile10/2024/M2",
        "confidence": "high"
      },
      {
        "id": "owasp/mobile10/2024/M6",
        "confidence": "high"
      }
    ]
  }
}