{
  "schema_version": "1.0",
  "id": "concept:pending-intent-mutable",
  "slug": "pending-intent-mutable",
  "title": "Mutable PendingIntent",
  "kind": "vulnerability",
  "aliases": [
    "mutable pendingintent",
    "pendingintent mutability"
  ],
  "parents": [
    "concept:android",
    "concept:misconfiguration"
  ],
  "mappings": {
    "cwe": [
      {
        "id": "cwe/CWE-269",
        "confidence": "high"
      }
    ],
    "owasp_mobile10": [
      {
        "id": "owasp/mobile10/2024/M8",
        "confidence": "high"
      }
    ]
  }
}