{
  "schema_version": "1.0",
  "id": "concept:resource-consumption",
  "slug": "resource-consumption",
  "title": "Unrestricted Resource Consumption",
  "kind": "vulnerability",
  "aliases": [
    "expensive query dos",
    "resource consumption"
  ],
  "parents": [
    "concept:api",
    "concept:availability"
  ],
  "mappings": {
    "cwe": [
      {
        "id": "cwe/CWE-400",
        "confidence": "medium"
      },
      {
        "id": "cwe/CWE-770",
        "confidence": "medium"
      }
    ],
    "owasp_api10": [
      {
        "id": "owasp/api10/2023/API4",
        "confidence": "high"
      }
    ]
  }
}