{
  "schema_version": "1.0",
  "id": "concept:sessionstorage-sensitive",
  "slug": "sessionstorage-sensitive",
  "title": "Sensitive Data in SessionStorage",
  "kind": "vulnerability",
  "aliases": [
    "sessionstorage sensitive"
  ],
  "parents": [
    "concept:data-exposure",
    "concept:storage-web"
  ],
  "mappings": {
    "cwe": [
      {
        "id": "cwe/CWE-922",
        "confidence": "high"
      }
    ]
  }
}