{
  "schema_version": "1.0",
  "id": "concept:replay-attack",
  "slug": "replay-attack",
  "title": "Replay Attack",
  "kind": "vulnerability",
  "aliases": [
    "replay attack",
    "request replay"
  ],
  "parents": [
    "concept:api",
    "concept:business-logic"
  ],
  "mappings": {
    "cwe": [
      {
        "id": "cwe/CWE-294",
        "confidence": "high"
      }
    ],
    "owasp_api10": [
      {
        "id": "owasp/api10/2023/API6",
        "confidence": "high"
      }
    ]
  }
}