{
  "schema_version": "1.0",
  "id": "concept:otp-bruteforce",
  "slug": "otp-bruteforce",
  "title": "OTP Brute Force",
  "kind": "variant",
  "aliases": [
    "2fa bruteforce",
    "otp bruteforce"
  ],
  "parents": [
    "concept:broken-authentication"
  ],
  "mappings": {
    "cwe": [
      {
        "id": "cwe/CWE-307",
        "confidence": "high"
      }
    ]
  }
}