{
  "schema_version": "1.0",
  "id": "concept:missing-hsts",
  "slug": "missing-hsts",
  "title": "Missing HSTS",
  "kind": "vulnerability",
  "aliases": [
    "missing hsts",
    "no hsts"
  ],
  "parents": [
    "concept:security-headers"
  ],
  "mappings": {
    "cwe": [
      {
        "id": "cwe/CWE-319",
        "confidence": "high"
      }
    ]
  }
}