{
  "schema_version": "1.0",
  "id": "concept:secrets-in-vcs",
  "slug": "secrets-in-vcs",
  "title": "Secrets Committed to VCS",
  "kind": "vulnerability",
  "aliases": [
    "credentials in repo",
    "exposed secret on github",
    "github secret leak",
    "secret committed",
    "secrets in git"
  ],
  "parents": [
    "concept:data-exposure",
    "concept:secrets-exposure"
  ],
  "mappings": {
    "cwe": [
      {
        "id": "cwe/CWE-798",
        "confidence": "medium"
      },
      {
        "id": "cwe/CWE-200",
        "confidence": "medium"
      }
    ]
  }
}