{
  "schema_version": "1.0",
  "id": "concept:insecure-backup",
  "slug": "insecure-backup",
  "title": "Insecure Backup",
  "kind": "vulnerability",
  "aliases": [
    "adb backup",
    "android backup enabled",
    "ios backup leak"
  ],
  "parents": [
    "concept:mobile-storage"
  ],
  "mappings": {
    "cwe": [
      {
        "id": "cwe/CWE-312",
        "confidence": "high"
      }
    ],
    "owasp_mobile10": [
      {
        "id": "owasp/mobile10/2024/M9",
        "confidence": "high"
      }
    ]
  }
}