{
  "schema_version": "1.0",
  "id": "concept:xss-stored",
  "slug": "xss-stored",
  "title": "Stored XSS",
  "kind": "variant",
  "aliases": [
    "persistent xss",
    "stored xss",
    "sxss",
    "sxxss"
  ],
  "parents": [
    "concept:xss-generic"
  ],
  "mappings": {
    "cwe": [
      {
        "id": "cwe/CWE-79",
        "confidence": "high"
      }
    ]
  }
}