{
  "schema_version": "1.0",
  "id": "concept:outdated-mobile-dependency",
  "slug": "outdated-mobile-dependency",
  "title": "Outdated Mobile Dependency",
  "kind": "vulnerability",
  "aliases": [
    "outdated dependency mobile",
    "outdated sdk"
  ],
  "parents": [
    "concept:components",
    "concept:mobile-supply-chain"
  ],
  "mappings": {
    "owasp_mobile10": [
      {
        "id": "owasp/mobile10/2024/M2",
        "confidence": "high"
      }
    ]
  }
}