{
  "schema_version": "1.0",
  "id": "concept:mobile-credentials",
  "slug": "mobile-credentials",
  "title": "Credential Usage",
  "kind": "category",
  "aliases": [
    "credential usage",
    "secrets handling"
  ],
  "parents": [
    "concept:data-exposure",
    "concept:mobile"
  ],
  "mappings": {
    "owasp_mobile10": [
      {
        "id": "owasp/mobile10/2024/M1",
        "confidence": "high"
      }
    ]
  }
}